{
  "schema_version": "0.2.0",
  "test": {
    "id": "https://w3id.org/battinfo/test/2c4r-8p6k-1m7t-9x3v",
    "short_id": "2c4r8p",
    "identifier": "test:2c4r-8p6k-1m7t-9x3v",
    "cell_id": "https://w3id.org/battinfo/cell/3m6k-9t2p-7x4h-9nq8",
    "name": "A123 ANR26650M1-B rate capability sweep",
    "description": "Stepwise charge and discharge rate capability characterization for one physical cell instance.",
    "kind": "rate_capability",
    "status": "completed",
    "protocol_name": "0.2C to 5C rate capability sweep",
    "started_at": 1771891200,
    "ended_at": 1771977600,
    "dataset_ids": [
      "https://w3id.org/battinfo/dataset/1f8r-6v2k-9p4m-3t7x"
    ]
  },
  "provenance": {
    "source_type": "measurement",
    "source_url": "https://example.org/lab-data/dataset-1f8r-6v2k-9p4m-3t7x",
    "source_file": "test-2c4r-8p6k-1m7t-9x3v.json",
    "retrieved_at": 1771977600,
    "workflow_version": "0.2.0",
    "citation": "https://example.org/lab-data/dataset-1f8r-6v2k-9p4m-3t7x"
  },
  "notes": [
    "Example for the rate_capability test kind."
  ]
}
